### ISSUE TITLE
WinHttpException on WebRequest 

### ISSUE THREAD

**Issue by davidelettieri** [dotnet/corefx#29687]
The following snippet of code call a web service using a certificate from the user store. I got a generic security exception

> System.Net.Http.WinHttpException (0x80072F8F): A security error occurred

with **NativeErrorCode 12175**. The same snippet works against .NET Framework 4.6.1.

Any guidance on troubleshooting this issue?

```c#
using (var store = new X509Store(StoreName.My, StoreLocation.CurrentUser))
{
    store.Open(OpenFlags.ReadOnly);
    var cert = store.Certificates.Find(X509FindType.FindBySerialNumber, "serial_number", false);
    HttpWebRequest request = (HttpWebRequest)WebRequest.Create("https://url");
    request.ClientCertificates.Add(cert[0]);
    request.Method = "GET";
    request.ServerCertificateValidationCallback = delegate
    {
        // I know this is unsafe
        return true;
    };
    HttpWebResponse response = (HttpWebResponse)request.GetResponse();

    var encoding = Encoding.UTF8;
    using (var reader = new StreamReader(response.GetResponseStream(), encoding))
    {
        string responseText = reader.ReadToEnd();
    }
}
```

[EDIT] C# syntax highlighting by @karelz

**Comment by davidelettieri** [comment]
I rewrote the code to use the HttpClient api as

<pre>
<code>
using (var store = new X509Store(StoreName.My, StoreLocation.CurrentUser))
{
    store.Open(OpenFlags.ReadOnly);
    var cert = store.Certificates.Find(X509FindType.FindBySerialNumber, "serial_number", false);

    var handler = new HttpClientHandler();
    handler.ClientCertificateOptions = ClientCertificateOption.Manual;
    handler.SslProtocols = SslProtocols.Tls12 | SslProtocols.Tls | SslProtocols.Tls11;
    handler.ClientCertificates.AddRange(cert);
    handler.ServerCertificateCustomValidationCallback = delegate
    {
        return true;
    };
    var client = new HttpClient(handler);
    var result = client.GetAsync("https://url").GetAwaiter().GetResult();
}
</code></pre>

and still having issues since both use winhttphandler under the hood. By debugging the .NET core code I think that the exception is thrown at the SendAsync method of WinHttpHandler.cs at the line 560 **in bold**
<pre>
<code>
            Task.Factory.StartNew(
                s => {
                    <b>var whrs = (WinHttpRequestState)s;</b>
                    whrs.Handler.StartRequest(whrs);
                },
                state,
                CancellationToken.None,
                TaskCreationOptions.DenyChildAttach,
                TaskScheduler.Default);
</code></pre>

**Comment by davidsh** [comment]
This is probably a duplicate of #17226.

Please try out .NET Core 2.1 RC which uses a different HTTP stack (SocketHttpHandler) underneath HttpClientHandler.

See: https://blogs.msdn.microsoft.com/dotnet/2018/05/07/announcing-net-core-2-1-rc-1/

**Comment by davidelettieri** [comment]
I updated .NET Core to 2.1 RC

>dotnet --version
> 2.1.300-rc1-008673

I'm still having issues but the exception is different now. As in #17226 the ServerCertificateCustomValidationCallback is not called.

<pre>
Unhandled Exception: System.Net.Http.HttpRequestException: The SSL connection could not be established, see inner exception. ---> System.Security.Authentication.AuthenticationException: Authentication failed, see inner exception. ---> System.ComponentModel.Win32Exception: The message received was unexpected or badly formatted
   --- End of inner exception stack trace ---
   at System.Net.Security.SslState.StartSendAuthResetSignal(ProtocolToken message, AsyncProtocolRequest asyncRequest, ExceptionDispatchInfo exception)
   at System.Net.Security.SslState.CheckCompletionBeforeNextReceive(ProtocolToken message, AsyncProtocolRequest asyncRequest)
   at System.Net.Security.SslState.StartSendBlob(Byte[] incoming, Int32 count, AsyncProtocolRequest asyncRequest)
   at System.Net.Security.SslState.ProcessReceivedBlob(Byte[] buffer, Int32 count, AsyncProtocolRequest asyncRequest)
   at System.Net.Security.SslState.StartReadFrame(Byte[] buffer, Int32 readBytes, AsyncProtocolRequest asyncRequest)
   at System.Net.Security.SslState.PartialFrameCallback(AsyncProtocolRequest asyncRequest)
--- End of stack trace from previous location where exception was thrown ---
   at System.Net.Security.SslState.ThrowIfExceptional()
   at System.Net.Security.SslState.InternalEndProcessAuthentication(LazyAsyncResult lazyResult)
   at System.Net.Security.SslState.EndProcessAuthentication(IAsyncResult result)
   at System.Net.Security.SslStream.EndAuthenticateAsClient(IAsyncResult asyncResult)
   at System.Net.Security.SslStream.<>c.<AuthenticateAsClientAsync>b__47_1(IAsyncResult iar)
   at System.Threading.Tasks.TaskFactory`1.FromAsyncCoreLogic(IAsyncResult iar, Func`2 endFunction, Action`1 endAction, Task`1 promise, Boolean requiresSynchronization)
--- End of stack trace from previous location where exception was thrown ---
   at System.Net.Http.ConnectHelper.EstablishSslConnectionAsyncCore(Stream stream, SslClientAuthenticationOptions sslOptions, CancellationToken cancellationToken)
   --- End of inner exception stack trace ---
   at System.Net.Http.ConnectHelper.EstablishSslConnectionAsyncCore(Stream stream, SslClientAuthenticationOptions sslOptions, CancellationToken cancellationToken)
   at System.Threading.Tasks.ValueTask`1.get_Result()
   at System.Net.Http.HttpConnectionPool.CreateConnectionAsync(HttpRequestMessage request, CancellationToken cancellationToken)
   at System.Threading.Tasks.ValueTask`1.get_Result()
   at System.Net.Http.HttpConnectionPool.WaitForCreatedConnectionAsync(ValueTask`1 creationTask)
   at System.Threading.Tasks.ValueTask`1.get_Result()
   at System.Net.Http.HttpConnectionPool.SendWithRetryAsync(HttpRequestMessage request, Boolean doRequestAuth, CancellationToken cancellationToken)
   at System.Net.Http.RedirectHandler.SendAsync(HttpRequestMessage request, CancellationToken cancellationToken)
   at System.Net.Http.HttpClient.FinishSendAsyncBuffered(Task`1 sendTask, HttpRequestMessage request, CancellationTokenSource cts, Boolean disposeCts)</pre>

**Comment by davidsh** [comment]
>System.ComponentModel.Win32Exception: The message received was unexpected or badly formatted

What is the server that you are connecting to?  It looks like the server is sending back bad TLS protocol or perhaps the client certificate you are using is corrupted and this is corrupting the protocol as well.

Does this repro if you don't use client certificates?

If order to debug this, we would need a repro that we could run ourselves.  Collecting Wireshark traces would also be useful.

**Comment by davidelettieri** [comment]
The server should be working since I'm able to connect with the snippet from the first comment using the full .NET framework and as far as I know several other clients are connecting to it with the same certificate.

>Does this repro if you don't use client certificates?

I don't understand this.

>If order to debug this, we would need a repro that we could run ourselves. Collecting Wireshark traces would also be useful.

Right now I'm not able to share the url and the certificate since the server is not from our organization.

**Comment by karelz** [comment]
@davidelettieri do you plan to debug it using Wireshark traces or under debugger?
That seems to be the only way to make further progress if you cannot provide a repro.

**Comment by davidelettieri** [comment]
This is a Wireshark extraction. In bold where things get different between core and 4.6.1. I don't know if this is enough, I would like to avoid disclose sensitive information about the server and the certificates. Let me know if there is something more or different I can try to debug the issue. 

.NET 4.6.1

Source | Destination | Protocol | Length | Info
-- | -- | -- | -- | --
Client | Server | TCP | 66 | 57609  >  8442 [SYN] Seq=0 Win=64240 Len=0 MSS=1460   WS=256 SACK_PERM=1
Server | Client | TCP | 66 | 8442  >  57609 [SYN, ACK] Seq=0 Ack=1 Win=14600   Len=0 MSS=1460 SACK_PERM=1 WS=128
Client | Server | TCP | 54 | 57609  >  8442 [ACK] Seq=1 Ack=1 Win=65536 Len=0
Client | Server | TLSv1.2 | 201 | Client Hello
Server | Client | TCP | 60 | 8442  >  57609 [ACK] Seq=1 Ack=148 Win=15744 Len=0
Server | Client | TLSv1.2 | 1514 | Server Hello
Server | Client | TLSv1.2 | 1292 | Certificate, Certificate Request, Server Hello Done
Client | Server | TCP | 54 | 57609  >  8442 [ACK] Seq=148 Ack=2699 Win=65536 Len=0
**Client** | **Server** | **TLSv1.2** | **1824** | **Certificate, Client Key Exchange, Certificate Verify, Change Cipher Spec,   Encrypted Handshake Message**
Server | Client | TCP | 60 | 8442  >  57609 [ACK] Seq=2699 Ack=1608 Win=18688   Len=0
Server | Client | TCP | 60 | 8442  >  57609 [ACK] Seq=2699 Ack=1918 Win=21632   Len=0
Server | Client | TLSv1.2 | 105 | Change Cipher Spec, Encrypted Handshake Message
Client | Server | TLSv1.2 | 195 | Application Data
Server | Client | TLSv1.2 | 406 | Application Data
Server | Client | TLSv1.2 | 184 | Application Data
Server | Client | TLSv1.2 | 85 | Application Data
Server | Client | TLSv1.2 | 88 | Application Data
Client | Server | TCP | 54 | 57609  >  8442 [ACK] Seq=2059 Ack=3297 Win=65024   Len=0
Client | Server | TCP | 54 | 57609  >  8442 [RST, ACK] Seq=2059 Ack=3297 Win=0   Len=0



.NET CORE


Source | Destination | Protocol | Length | Info
-- | -- | -- | -- | --
Client | Server | TCP | 66 | 57610  >  8442 [SYN] Seq=0 Win=64240 Len=0 MSS=1460   WS=256 SACK_PERM=1
Server | Client | TCP | 66 | 8442  >  57610 [SYN, ACK] Seq=0 Ack=1 Win=14600   Len=0 MSS=1460 SACK_PERM=1 WS=128
Client | Server | TCP | 54 | 57610  >  8442 [ACK] Seq=1 Ack=1 Win=65536 Len=0
Client | Server | TLSv1.2 | 201 | Client Hello
Server | Client | TCP | 60 | 8442  >  57610 [ACK] Seq=1 Ack=148 Win=15744 Len=0
Server | Client | TLSv1.2 | 1514 | Server Hello
Server | Client | TLSv1.2 | 1292 | Certificate, Certificate Request, Server Hello Done
Client | Server | TCP | 54 | 57610  >  8442 [ACK] Seq=148 Ack=2699 Win=65536 Len=0
**Client** | **Server** | **TLSv1.2** | **379** | **Certificate, Client Key Exchange, Change Cipher Spec, Encrypted Handshake   Message**
Server | Client | TCP | 60 | 8442  >  57610 [ACK] Seq=2699 Ack=473 Win=16768   Len=0
Server | Client | TLSv1.2 | 61 | Alert (Level: Fatal, Description: Handshake Failure)
Server | Client | TCP | 60 | 8442  >  57610 [FIN, ACK] Seq=2706 Ack=473 Win=16768   Len=0
Client | Server | TCP | 54 | 57610  >  8442 [ACK] Seq=473 Ack=2707 Win=65536 Len=0
Client | Server | TCP | 54 | 57610  >  8442 [FIN, ACK] Seq=473 Ack=2707 Win=65536   Len=0
Server | Client | TCP | 60 | 8442  >  57610 [ACK] Seq=2707 Ack=474 Win=16768   Len=0

**Comment by davidelettieri** [comment]
>The server is causing the TLS connection to be dropped by sending back this TLS alert. Can you get logs for your server?

I can't access the server.

>What kind of signature algorithm is being used on the client certificate? Is it at least SHA256? I think the problem is related to the client certificate.

The certificate is only SHA1
![image](https://user-images.githubusercontent.com/5262655/40184095-ae985152-59ef-11e8-87b1-33256f5522f8.png)

I thought it could be a problem but since it is working on 4.6.1 I dropped the idea. I don't know if this can change.

>The problem could also be the lack of the "Certificate Verify" being sent from client to server. The trace shows on .NET Framework that "Certificate Verify" is being sent. But on .NET Core, it is not.

I noted that, don't know if I can do anything to change that in my client code.

**Comment by davidsh** [comment]
My guess is that this has to do with the "strong crypto" defaults.  .NET Core always opts into strong crypto settings.  Latest versions of .NET Framework such as 4.6+ do as well but earlier versions need to opt-in. It's possible that you might be running on .NET 4.6.1 but the application is still targeting an earlier .NET version which doesn't opt-in to the stronger crypto defaults. 

See: https://docs.microsoft.com/en-us/dotnet/framework/network-programming/tls

The use of SHA1 certificates is being deprecated as it is not secure.  The difference in the Wireshark traces show that "Certificate Verify" is sent on the client machine running .NET Framework 4.6.1 to the server.  But "Certificate Verify" is not sent from the client running .NET Core.  This is why the server sends back the TLS alert.

If you opt-in to strong crypto on your .NET Framework 4.6.x machine (use registry key):
https://docs.microsoft.com/en-us/dotnet/framework/network-programming/tls#schusestrongcrypto

then you would probably see the same TLS handshake failure.

The fix here is to stop using SHA1 certificates.

**Comment by davidsh** [comment]
Also, what are the OS versions for the .NET 4.6.1 machine vs. the .NET Core 2.x machine?

**Comment by davidelettieri** [comment]
I'm working on a windows 10 fully updated. After changing target framework and registry key I'm having inconsistent results.

I asked for a certificate with an updated signature algorithm, I'll let you know when I have more info.

**Comment by davidelettieri** [comment]
I don't know if it's related to the signature algorithm but from the wireshark traces it looks like the certificate is not being added to the request 

![image](https://user-images.githubusercontent.com/5262655/40481058-7aa292e8-5f50-11e8-97f7-f08b978d9d98.png)

while it's being sent on the working calls 

![image](https://user-images.githubusercontent.com/5262655/40481131-baeae5da-5f50-11e8-946b-f280aa4d4e30.png)

**Comment by davidsh** [comment]
@davidelettieri Since we didn't back from you in a while, I assume that the problem was due to the client certificates as I described above.  So, we'll be closing this issue now.

**Comment by davidelettieri** [comment]
Actually I'm still waiting for the new certificate from the other party. I will reopen the issue if needed. Thanks for your support.
