### ISSUE TITLE
WCF on Linux - Kerberos Authentication with UpnEndpointIdentity seems to be sending the wrong name-type to the KDC.

### ISSUE THREAD

**Issue by jonwingfield** [dotnet/corefx#41489]
Hi,

So I'm really struggling with getting a .NET Core app running on Linux because of Kerberos. The app is a client that is communicating with a WCF service running on a windows server. The Service runs under a service account, so the client specifies a UpnEndpointIdentity. This works great on windows, but when trying to run it on Ubuntu, I'm getting GSSAPI errors. Specifically this: 

>System.ServiceModel.Security.SecurityNegotiationException: Authentication failed, see inner exception.
>  ---> System.Security.Authentication.AuthenticationException: Authentication failed, see inner exception.
> ---> System.ComponentModel.Win32Exception (0x80090020): GSSAPI operation failed with error - Unspecified GSS failure.  Minor code may provide more information (Server not found in Kerberos database).

I'm no Kerberos expert, but I've started to dig into the Wireshark traces and it looks like on windows it's sending a request to the KDC with an sname name-type of `kRB5-NT-SRV-HST (3)`. On Ubuntu, it's instead sending name-type: `kRB5-NT-PRINCIPAL (1)`. The KDC is rejecting the request with `KRB5KDC_ERR_S_PRINCIPAL_UNKNOWN`, which makes sense since the client is asking for a host instead of a principal.

Also, I'm able to correctly acquire a service ticket using `kgetcred` for the UPN, and I can see it correctly sent in the wireshark trace. Is this a bug in .NET Cores interaction with GSSAPI, or WCF, or am I just missing something? @davidsh Wrote some of this code so I'm hoping he can help.

I'm happy to provide the Wireshark traces if that will help, or any more details needed.

Thanks!

**Comment by davidsh** [comment]
We made a great deal of fixes for Kerberos related scenarios in .NET Core 3.0. These fixes are not all backported to .NET Core 2.1/2.2.

I suggest you try .NET Core 3.0 to see if it works better.  However, we still have some limitations with UPNs compared with our SPN support.

Also, in order to fully diagnose this, please attach a repro client/server solution so that we can try it out.

**Comment by jonwingfield** [comment]
Hi @davidsh and thanks for the quick response. We're on .NET Core 3.0. We noticed a lot of changes for Windows Auth in 3.0 so we immediately upgraded. 

I'll work on getting a repro put together. In the meantime, should we try `SpnEndpointIdentity` as a workaround? That seems like a reasonable option?

**Comment by davidsh** [comment]
>In the meantime, should we try SpnEndpointIdentity as a workaround? That seems like a reasonable option?

Yes, that would be a good workaround potentially.

Also, please show a KRB5_TRACE for your application. It will show useful output.

```sh
export KRB5_TRACE=/dev/stdout
dotnet YOURAPPLICATION.dll
```

**Comment by davidsh** [comment]
cc: @mconnew

**Comment by jonwingfield** [comment]
Here is the output from KR5_TRACE (I've replaced our domain with Corp.Test.Lcl):

```
[2986] 1570024870.140256: ccselect module hostname chose cache FILE:/tmp/krb5cc_1000 with client principal jpwingfield@corp.test.lcl for server principal svcAXBCPDV/corp.test.lcl@test.lcl
[2986] 1570024870.140257: Getting credentials jpwingfield@corp.test.lcl -> svcAXBCPDV/corp.test.lcl@ using ccache FILE:/tmp/krb5cc_1000
[2986] 1570024870.140258: Retrieving jpwingfield@corp.test.lcl -> svcAXBCPDV/corp.test.lcl@ from FILE:/tmp/krb5cc_1000 with result: -1765328243/Matching credential not found (filename: /tmp/krb5cc_1000)
[2986] 1570024870.140259: Retrying jpwingfield@corp.test.lcl -> svcAXBCPDV/corp.test.lcl@corp.test.lcl with result: -1765328243/Matching credential not found (filename: /tmp/krb5cc_1000)
[2986] 1570024870.140260: Server has referral realm; starting with svcAXBCPDV/corp.test.lcl@corp.test.lcl
[2986] 1570024870.140261: Retrieving jpwingfield@corp.test.lcl -> krbtgt/corp.test.lcl@corp.test.lcl from FILE:/tmp/krb5cc_1000 with result: 0/Success
[2986] 1570024870.140262: Starting with TGT for client realm: jpwingfield@corp.test.lcl -> krbtgt/corp.test.lcl@corp.test.lcl
[2986] 1570024870.140263: Requesting tickets for svcAXBCPDV/corp.test.lcl@corp.test.lcl, referrals on
[2986] 1570024870.140264: Generated subkey for TGS request: aes256-cts/1635
[2986] 1570024870.140265: etypes requested in TGS request: aes256-cts, aes128-cts, aes256-sha2, aes128-sha2, des3-cbc-sha1, rc4-hmac, camellia128-cts, camellia256-cts
[2986] 1570024870.140267: Encoding request body and padata into FAST request
[2986] 1570024870.140268: Sending request (6800 bytes) to corp.test.lcl
[2986] 1570024870.140269: Resolving hostname CLWDSPD02.corp.test.lcl
[2986] 1570024870.140270: Initiating TCP connection to stream 10.10.7.3:88
[2986] 1570024870.140271: Sending TCP request to stream 10.10.7.3:88
[2986] 1570024870.140272: Received answer (102 bytes) from stream 10.10.7.3:88
[2986] 1570024870.140273: Terminating TCP connection to stream 10.10.7.3:88
[2986] 1570024870.140274: Sending DNS URI query for _kerberos.corp.test.lcl.
[2986] 1570024870.140275: No URI records found
[2986] 1570024870.140276: Sending DNS SRV query for _kerberos-master._udp.corp.test.lcl.
[2986] 1570024870.140277: Sending DNS SRV query for _kerberos-master._tcp.corp.test.lcl.
[2986] 1570024870.140278: No SRV records found
[2986] 1570024870.140279: Response was not from master KDC
[2986] 1570024870.140280: TGS request result: -1765328377/Server not found in Kerberos database
[2986] 1570024870.140281: Local realm referral failed; trying fallback realm test.lcl
[2986] 1570024870.140282: Retrieving jpwingfield@corp.test.lcl -> krbtgt/test.lcl@test.lcl from FILE:/tmp/krb5cc_1000 with result: -1765328243/Matching credential not found (filename: /tmp/krb5cc_1000)
[2986] 1570024870.140283: Retrieving jpwingfield@corp.test.lcl -> krbtgt/corp.test.lcl@corp.test.lcl from FILE:/tmp/krb5cc_1000 with result: 0/Success
[2986] 1570024870.140284: Starting with TGT for client realm: jpwingfield@corp.test.lcl -> krbtgt/corp.test.lcl@corp.test.lcl
[2986] 1570024870.140285: Retrieving jpwingfield@corp.test.lcl -> krbtgt/test.lcl@test.lcl from FILE:/tmp/krb5cc_1000 with result: -1765328243/Matching credential not found (filename: /tmp/krb5cc_1000)
[2986] 1570024870.140286: Requesting TGT krbtgt/test.lcl@corp.test.lcl using TGT krbtgt/corp.test.lcl@corp.test.lcl
[2986] 1570024870.140287: Generated subkey for TGS request: aes256-cts/7285
[2986] 1570024870.140288: etypes requested in TGS request: aes256-cts, aes128-cts, aes256-sha2, aes128-sha2, des3-cbc-sha1, rc4-hmac, camellia128-cts, camellia256-cts
[2986] 1570024870.140290: Encoding request body and padata into FAST request
[2986] 1570024870.140291: Sending request (6782 bytes) to corp.test.lcl
[2986] 1570024870.140292: Resolving hostname CLWDSPD02.corp.test.lcl
[2986] 1570024870.140293: Initiating TCP connection to stream 10.10.7.3:88
[2986] 1570024870.140294: Sending TCP request to stream 10.10.7.3:88
[2986] 1570024870.140295: Received answer (93 bytes) from stream 10.10.7.3:88
[2986] 1570024870.140296: Terminating TCP connection to stream 10.10.7.3:88
[2986] 1570024870.140297: Sending DNS URI query for _kerberos.corp.test.lcl.
[2986] 1570024870.140298: No URI records found
[2986] 1570024870.140299: Sending DNS SRV query for _kerberos-master._udp.corp.test.lcl.
[2986] 1570024870.140300: Sending DNS SRV query for _kerberos-master._tcp.corp.test.lcl.
[2986] 1570024870.140301: No SRV records found
[2986] 1570024870.140302: Response was not from master KDC
[2986] 1570024870.140303: TGS request result: -1765328377/Server not found in Kerberos database
```

10.10.7.3 is the KDC. svcAXBCPDV@corp.test.lcl is the UPN that the WCF service is running under, and the UPN we're providing on the client. This matches what I'm seeing in Wireshark almost exactly.

One note: the additional query for krbtgt/test.lcl@test.lcl is strange. That's not happening on windows.

**Comment by SteveSyfuhs** [comment]
The name-type is only ever really used as a hint in the AD KDC. Can you confirm the `name-string` values actually match between the Windows and Linux requests? Often there's some canonicalization going on or there's a mixup in service type in the SPN.

**Comment by mconnew** [comment]
WCF can't implement this for the HTTP transport because of a missing feature in HttpClientHandler compared with .NET Framework. The issue I've opened to request this missing feature is #27745. I suggest adding a thumbs up on the first comment to register that you need this. Currently SpnIdentity won't work either. Recently a sort of workaround was added to HttpClientHandler where you can indirectly specify an SPN by adding a HOST header with that SPN. But that is just a hack which won't work in some scenarios. Rather than WCF implement a partial solution which will only work sometimes and will cause confusion, I would prefer that issue #27745 is addressed. If you want to do this yourself, WCF has an extensibility point so you can do this yourself. There's a [blog post](https://habr.com/en/company/true_engineering/blog/465421/) which outlines the general approach that someone wrote up. There's also a pretty good example [here](https://github.com/dotnet/wcf/issues/3472#issuecomment-474427038) of how to use this by providing a delegating handler. In your delegating handler you would add a Host header before you call SendAsync on the wrapped handler.

**Comment by jonwingfield** [comment]
@SteveSyfuhs 

They're slightly different. On Ubuntu, it's sending this in the request-body:

```
Frame 55: 1018 bytes on wire (8144 bits), 1018 bytes captured (8144 bits) on interface 0
Ethernet II, Src: Cisco_3c:7a:00 (00:05:9a:3c:7a:00), Dst: Cimsys_33:44:55 (00:11:22:33:44:55)
Internet Protocol Version 4, Src: 10.10.1.43, Dst: 10.10.7.3
Transmission Control Protocol, Src Port: 50029, Dst Port: 88, Seq: 5841, Ack: 1, Len: 964
[9 Reassembled TCP Segments (6804 bytes): #47(1366), #48(94), #49(1366), #50(94), #51(1366), #52(94), #53(1366), #54(94), #55(964)]
Kerberos
    Record Mark: 6800 bytes
    tgs-req
        pvno: 5
        msg-type: krb-tgs-req (12)
        padata: 2 items
        req-body
            Padding: 0
            kdc-options: 50010000 (forwardable, proxiable, canonicalize)
            realm: CORP.TEST.LCL
            sname
                name-type: kRB5-NT-SRV-HST (3)
                sname-string: 2 items
                    SNameString: svcAXBCPDV
                    SNameString: corp.test.lcl
            till: 2019-10-01 10:56:05 (UTC)
            nonce: 1122014012
            etype: 8 items
                ENCTYPE: eTYPE-AES256-CTS-HMAC-SHA1-96 (18)
                ENCTYPE: eTYPE-AES128-CTS-HMAC-SHA1-96 (17)
                ENCTYPE: eTYPE-AES256-CTS-HMAC-SHA384-192 (20)
                ENCTYPE: eTYPE-AES128-CTS-HMAC-SHA256-128 (19)
                ENCTYPE: eTYPE-DES3-CBC-SHA1 (16)
                ENCTYPE: eTYPE-ARCFOUR-HMAC-MD5 (23)
                ENCTYPE: eTYPE-CAMELLIA128-CTS-CMAC (25)
                ENCTYPE: eTYPE-CAMELLIA256-CTS-CMAC (26)

```

On Windows, it's:
```
Frame 18: 1299 bytes on wire (10392 bits), 1299 bytes captured (10392 bits) on interface 0
Ethernet II, Src: Cisco_3c:7a:00 (00:05:9a:3c:7a:00), Dst: Cimsys_33:44:55 (00:11:22:33:44:55)
Internet Protocol Version 4, Src: 10.10.1.43, Dst: 10.10.7.5
Transmission Control Protocol, Src Port: 50004, Dst Port: 88, Seq: 5465, Ack: 1, Len: 1245
[5 Reassembled TCP Segments (6709 bytes): #14(1366), #15(1366), #16(1366), #17(1366), #18(1245)]
Kerberos
    Record Mark: 6705 bytes
    tgs-req
        pvno: 5
        msg-type: krb-tgs-req (12)
        padata: 2 items
        req-body
            Padding: 0
            kdc-options: 40810000 (forwardable, renewable, canonicalize)
            realm: CORP.TEST.LCL
            sname
                name-type: kRB5-NT-PRINCIPAL (1)
                sname-string: 1 item
                    SNameString: svcAXBCPDV
            till: 2037-09-13 02:48:05 (UTC)
            nonce: 544141559
            etype: 5 items
            enc-authorization-data
```

Could it be the extra sname string for the realm? I'm using the same UPN in both (svcAXBCPDV@corp.test.lcl).

**Comment by SteveSyfuhs** [comment]
That is most likely why AD is complaining. You will need to add an additional SPN on the service account for it to match up against.

________________________________

**Comment by jonwingfield** [comment]
@SteveSyfuhs but why is it being sent this way? Are there details in GSSAPI that are causing it to be handled differently?

**Comment by SteveSyfuhs** [comment]
That I can't answer without debugging or reviewing code. The fully qualified name is most likely just what's being passed to the API and is _that_ value because of what @mconnew is suggesting.

________________________________

**Comment by mconnew** [comment]
In the Windows dump, you can see it's using the name-type "kRB5-NT-PRINCIPAL" which can be either an SPN or a UPN. In the Linux dump, it's using the type "kRB5-NT-SRV-HST" which I believe can't be used for UPN's.

**Comment by davidsh** [comment]
>In the Linux dump, it's using the type "kRB5-NT-SRV-HST" which I believe can't be used for UPN's.

We currently always use this type instead of KRB5_NT_PRINCIPAL.  That is because it is the only thing that works correctly with SPNEGO protocol and can handle Kerberos to NTLM fallback.

See:
https://github.com/dotnet/corefx/blob/eff9fbf446468ca411bf5e0475916f316eea7223/src/Native/Unix/System.Net.Security.Native/pal_gssapi.c#L157-L179

Long term, we need to probably adjust this if we know that we are using a UPN and not SPN.

**Comment by jonwingfield** [comment]
@davidsh Is this known to work with UPNs though? 

I'll have a minimal project with client and server to share tomorrow. This is really the most basic situation ever though. Generate new Wcf Service, host under a service account, bind a corefx client to it, run corefx project under Linux. I just want to make sure it reproduces in this minimal form on our infrastructure before sending it over.

**Comment by davidsh** [comment]
>@davidsh Is this known to work with UPNs though?

Probably not.  See related issue #6606

**Comment by mconnew** [comment]
@davidsh, on the capture from Windows, it's using kRB5-NT-PRINCIPAL. Are you saying this isn't using SPNEGO? Or is this a limitation of gssapi on Linux?

**Comment by davidsh** [comment]
>@davidsh, on the capture from Windows, it's using kRB5-NT-PRINCIPAL. Are you saying this isn't using SPNEGO? Or is this a limitation of gssapi on Linux?

Windows is using SPNEGO. But it's always using that particular KRB5 principal format.  Windows actually doesn't do a real job of using SPNEGO to downgrade from Kerberos to NTLM. If you look at the Wireshark traces on Windows, you will see that Windows uses "raw" NTLM packets. It does NOT use SPNEGO wrapped NTLM packets. In some ways, that is a violation of the spirit of "Negotiate" protocol (SPNEGO).

But Linux will use SPNEGO wrapped NTLM packets when it detects it needs to downgrade from Kerberos to NTLM. However, to get that to work properly on Linux with the current SPNEGO implementation, the kRB5-NT-SRV-HST needs to be used.

**Comment by jonwingfield** [comment]
@davidsh I've created a minimal project to reproduce this. It's almost completely just an out-of-the-box WCF Client/Server with a few details:

- Uses NetTcpBinding
- Service runs under a service account
- Client uses UpnEndpointIdentity. 

The client works fine on windows but fails on Ubuntu. The only thing I did on Ubuntu to run it is:

```
kinit
dotnet run
```

The same error as above is returned.

Here's the github repo: https://github.com/jonwingfield/Corefx3WcfKerberosFailure

**Comment by davidsh** [comment]
>@davidsh I've created a minimal project to reproduce this. It's almost completely just an out-of-the-box WCF Client/Server with a few details:

Thanks for the repro. Does this require any other configuration such as DNS or other Windows Active Directory / Linux Kerberos configurations?

Using any UPNs right now doesn't work as per #6606.

**Comment by mconnew** [comment]
@jonwingfield, I know it's a pain, but could you create a new SPN in your domain, give permissions to that SPN to the user that the service is running as and configure your WCF service to use that SPN? For example, use the spn nettcp/hostname. The ability to use a UPN is to allow you to avoid the complication of creating an SPN for a particular service and doesn't require any special permissions to do so. As it might be a while before your scenario is supported on Linux, being pragmatic it might be worth doing the work to get things working with an SPN instead.

**Comment by jonwingfield** [comment]
@davidsh It does require setup of a krb5.conf file, but this is environment dependent so I can't really provide an example file. There isn't anything extra to do other than specify the KDC and realms as outlined in this article: https://docs.microsoft.com/en-us/sql/connect/jdbc/using-kerberos-integrated-authentication-to-connect-to-sql-server?view=sql-server-ver15.
