### ISSUE TITLE
System.Data.SqlClient 4.5.1 Leaking Connection with Multisubnetfailover

### ISSUE THREAD

**Issue by n00j** [dotnet/corefx#31638]
I am using .NET Core 1.1.9 and System.Data.SqlClient 4.5.1 to connect to SQL Server 12.  It seems that when using multi subnet failover  the connections / file descriptors are never being released

OS: RHEL 7.3
Host: 1.0.0-preview2-1-003312 (rh-dotnetcore11)

```bash
$  dotnet --fx-version 1.1.9
Microsoft .NET Core Shared Framework Host

  Version  : 1.1.9
  Build    : bab3fbe43f62cf9dbdefb3140eb40516c98e11c1
```

Example Program which replicates issue: https://github.com/n00j/SqlPoolLeak 

We are running SQL Server in HA mode with multisubnetfailover and a listener which has two servers:
INTGCD01AG01L -> INTGCD01AG01L-NY, INTGCD01AG01L-NJ

Run the program, and grab the PID
![1](https://user-images.githubusercontent.com/105021/43804052-bb5134ea-9a68-11e8-8fb2-5c9475f6b20e.png)

Get the current open sockets
![2](https://user-images.githubusercontent.com/105021/43804055-bdb6c8bc-9a68-11e8-898c-023236db9cbd.png)

Another connection is being added to the pool. A connection is being made to both the NY, and NJ servers
![3](https://user-images.githubusercontent.com/105021/43804057-bfda1c16-9a68-11e8-9192-d41ff8bff378.png)

After a bit of time, the connection to the NY server fails / is closed. But the socket remains.
![4](https://user-images.githubusercontent.com/105021/43804062-c2fc93e2-9a68-11e8-92b1-116e01bf0a3e.png)

The fd are never released, and will continuously accumulate forever until the max number of file descriptors is reached and the process either crashes, or is in a bad state.

**Comment by n00j** [comment]
Just an update I tried similar code with the System.Data.SqlClient version 4.3.1 and it seems to behave better, but still seems to leak file descriptors

Using lsof
```bash
Wed Aug  8 15:18:10 EDT 2018
..
dotnet  14281 root  294u     IPv4             210005      0t0       TCP localhost:39206->intgcd01ag01l-nj.something.com:28589 (ESTABLISHED)
dotnet  14281 root  295u     IPv4             238455      0t0       TCP localhost:44528->intgcd01ag01l-nj.something.com:28589 (ESTABLISHED)
dotnet  14281 root  296u     IPv4             262769      0t0       TCP localhost:53096->intgcd01ag01l-nj.something.com:28589 (ESTABLISHED)
dotnet  14281 root  297u     IPv4             262872      0t0       TCP localhost:35262->intgcd01ag01l-ny.something.com:28589 (SYN_SENT)
dotnet  14281 root  298u     IPv4             262878      0t0       TCP localhost:33774->intgcd01ag01l-nj.something.com:28589 (ESTABLISHED)
```
A little while later
```bash
Wed Aug  8 15:20:11 EDT 2018
...
dotnet  14281 root  294u     IPv4             210005      0t0       TCP localhost:39206->intgcd01ag01l-nj.something.com:28589 (ESTABLISHED)
dotnet  14281 root  295u     IPv4             238455      0t0       TCP localhost:44528->intgcd01ag01l-nj.something.com:28589 (ESTABLISHED)
dotnet  14281 root  296u     IPv4             262769      0t0       TCP localhost:53096->intgcd01ag01l-nj.something.com:28589 (ESTABLISHED)
dotnet  14281 root  297u     sock                0,7      0t0    266474 protocol: TCP
dotnet  14281 root  298u     IPv4             262878      0t0       TCP localhost:33774->intgcd01ag01l-nj.something.com:28589 (ESTABLISHED)
```

From this the driver tries to connect to the **NY** side but that is the inactive side and fails to connect.  Below is the tcp dump from that socket. Sync packets are sent, connection is never established, and the fd / socket hangs around forever.
```bash
15:16:04.386415 IP (tos 0x0, ttl 64, id 46953, offset 0, flags [DF], proto TCP (6), length 60)
    1.70.160.112.35262 > 10.122.89.58.28589: Flags [S], cksum 0x0599 (incorrect -> 0x56e6), seq 921488075, win 29200, options [mss 1460,sackOK,TS val 14253474 ecr 0,nop,wscale 7], length 0
--
15:16:05.388119 IP (tos 0x0, ttl 64, id 46954, offset 0, flags [DF], proto TCP (6), length 60)
    1.70.160.112.35262 > 10.122.89.58.28589: Flags [S], cksum 0x0599 (incorrect -> 0x52fc), seq 921488075, win 29200, options [mss 1460,sackOK,TS val 14254476 ecr 0,nop,wscale 7], length 0
--
15:16:07.392119 IP (tos 0x0, ttl 64, id 46955, offset 0, flags [DF], proto TCP (6), length 60)
    1.70.160.112.35262 > 10.122.89.58.28589: Flags [S], cksum 0x0599 (incorrect -> 0x4b28), seq 921488075, win 29200, options [mss 1460,sackOK,TS val 14256480 ecr 0,nop,wscale 7], length 0
--
15:16:11.400120 IP (tos 0x0, ttl 64, id 46956, offset 0, flags [DF], proto TCP (6), length 60)
    1.70.160.112.35262 > 10.122.89.58.28589: Flags [S], cksum 0x0599 (incorrect -> 0x3b80), seq 921488075, win 29200, options [mss 1460,sackOK,TS val 14260488 ecr 0,nop,wscale 7], length 0
--
15:16:19.424122 IP (tos 0x0, ttl 64, id 46957, offset 0, flags [DF], proto TCP (6), length 60)
    1.70.160.112.35262 > 10.122.89.58.28589: Flags [S], cksum 0x0599 (incorrect -> 0x1c28), seq 921488075, win 29200, options [mss 1460,sackOK,TS val 14268512 ecr 0,nop,wscale 7], length 0
--
15:16:35.456122 IP (tos 0x0, ttl 64, id 46958, offset 0, flags [DF], proto TCP (6), length 60)
    1.70.160.112.35262 > 10.122.89.58.28589: Flags [S], cksum 0x0599 (incorrect -> 0xdd87), seq 921488075, win 29200, options [mss 1460,sackOK,TS val 14284544 ecr 0,nop,wscale 7], length 0
--
15:17:07.520121 IP (tos 0x0, ttl 64, id 46959, offset 0, flags [DF], proto TCP (6), length 60)
    1.70.160.112.35262 > 10.122.89.58.28589: Flags [S], cksum 0x0599 (incorrect -> 0x6047), seq 921488075, win 29200, options [mss 1460,sackOK,TS val 14316608 ecr 0,nop,wscale 7], length 0
```

**Comment by n00j** [comment]
I let my code run for 24 hours on two different machines with the same configuration. Only change was on one I was using 4.3.1, and on the other 4.5.1

File handles still increase on both, but 4.5.1 rate of increase is much higher. Ignore the large jump at the beginning of the file handle graph, that is from some trace commands I was running.

Green - Machine with 4.5.1
Yellow - Machine with 4.3.1
![5](https://user-images.githubusercontent.com/105021/43905304-cfda5516-9bbe-11e8-888d-f3c9679cf855.png)

**Comment by n00j** [comment]
Ran one more experiment, and it looks like it may not be SqlClient, but instead may be a problem with the underlying System.Net.Sockets implementation

I ran the same code on .NET Core 1.1 and .NET Core 2.1
The same code running on .NET Core 2.1 doesn't seem to have any leaks.

Green - Code Targeting .NET Core 2.1
Yellow - Code Targeting .NET Core 1.1
![6](https://user-images.githubusercontent.com/105021/44038361-9c48d91a-9ee4-11e8-84ed-5f64c0871dfb.png)


.NET Core 1.1:
```bash
[agupta5@public-100-71-22-229 ~]$ sudo lsof -p 13476 | grep TCP
dotnet  13476 root  210u     sock                0,7      0t0    41885 protocol: TCP
dotnet  13476 root  211u     sock                0,7      0t0    43453 protocol: TCP
dotnet  13476 root  228u     IPv4              41904      0t0      TCP *:32005 (LISTEN)
dotnet  13476 root  229u     sock                0,7      0t0    42096 protocol: TCP
dotnet  13476 root  230u     sock                0,7      0t0    43459 protocol: TCP
dotnet  13476 root  234u     sock                0,7      0t0    42250 protocol: TCP
dotnet  13476 root  235u     sock                0,7      0t0    43460 protocol: TCP
dotnet  13476 root  236u     IPv4              42258      0t0      TCP localhost:52979->intgcd01ag01l-nj.something.com:28589 (ESTABLISHED)
dotnet  13476 root  237u     sock                0,7      0t0    43465 protocol: TCP
dotnet  13476 root  238u     sock                0,7      0t0    42274 protocol: TCP
dotnet  13476 root  239u     sock                0,7      0t0    43470 protocol: TCP
dotnet  13476 root  240u     sock                0,7      0t0    43485 protocol: TCP
dotnet  13476 root  241u     sock                0,7      0t0    42290 protocol: TCP
dotnet  13476 root  242u     IPv4             107537      0t0      TCP localhost:52058->intgcd01ag01l-nj.something.com:28589 (ESTABLISHED)
dotnet  13476 root  255u     sock                0,7      0t0    43503 protocol: TCP
dotnet  13476 root  257u     IPv4              42318      0t0      TCP localhost:32834->intgcd01ag01l-nj.something.com:28589 (ESTABLISHED)
dotnet  13476 root  258u     sock                0,7      0t0    56888 protocol: TCP
dotnet  13476 root  265u     IPv4              52025      0t0      TCP localhost:34212->intgcd01ag01l-nj.something.com:28589 (ESTABLISHED)
dotnet  13476 root  266u     IPv4              55612      0t0      TCP localhost:49899->intgcd01ag01l-nj.something.com:28589 (ESTABLISHED)
dotnet  13476 root  267u     sock                0,7      0t0    57602 protocol: TCP
dotnet  13476 root  268u     sock                0,7      0t0    56188 protocol: TCP
dotnet  13476 root  269u     sock                0,7      0t0    60237 protocol: TCP
dotnet  13476 root  270u     IPv4              58782      0t0      TCP localhost:45598->intgcd01ag01l-nj.something.com:28589 (ESTABLISHED)
dotnet  13476 root  271u     IPv4              61547      0t0      TCP localhost:42499->intgcd01ag01l-nj.something.com:28589 (ESTABLISHED)
dotnet  13476 root  272u     sock                0,7      0t0    64793 protocol: TCP
dotnet  13476 root  273u     sock                0,7      0t0    63288 protocol: TCP
dotnet  13476 root  274u     IPv4              64839      0t0      TCP localhost:45341->intgcd01ag01l-nj.something.com:28589 (ESTABLISHED)
dotnet  13476 root  275u     sock                0,7      0t0    71109 protocol: TCP
...
...

dotnet  13476 root 4031u     sock                0,7      0t0  1410653 protocol: TCP
dotnet  13476 root 4032u     IPv4            1409232      0t0      TCP localhost:43293->intgcd01ag01l-ny.something.com:28589 (CLOSE_WAIT)
dotnet  13476 root 4033u     sock                0,7      0t0  1410705 protocol: TCP
dotnet  13476 root 4034u     IPv4            1409292      0t0      TCP localhost:52185->intgcd01ag01l-ny.something.com:28589 (CLOSE_WAIT)
dotnet  13476 root 4035u     IPv4            1409318      0t0      TCP localhost:33840->intgcd01ag01l-ny.something.com:28589 (CLOSE_WAIT)
dotnet  13476 root 4036u     sock                0,7      0t0  1411098 protocol: TCP
dotnet  13476 root 4037u     IPv4            1409715      0t0      TCP localhost:33903->intgcd01ag01l-ny.something.com:28589 (CLOSE_WAIT)
dotnet  13476 root 4038u     sock                0,7      0t0  1411100 protocol: TCP
dotnet  13476 root 4039u     IPv4            1409732      0t0      TCP localhost:49879->intgcd01ag01l-ny.something.com:28589 (CLOSE_WAIT)
dotnet  13476 root 4040u     sock                0,7      0t0  1411177 protocol: TCP
dotnet  13476 root 4041u     IPv4            1409790      0t0      TCP localhost:58134->intgcd01ag01l-ny.something.com:28589 (CLOSE_WAIT)
dotnet  13476 root 4042u     sock                0,7      0t0  1411190 protocol: TCP
dotnet  13476 root 4043u     sock                0,7      0t0  1409815 protocol: TCP
dotnet  13476 root 4044u     sock                0,7      0t0  1411207 protocol: TCP
dotnet  13476 root 4045u     IPv4            1409839      0t0      TCP localhost:57969->intgcd01ag01l-ny.something.com:28589 (CLOSE_WAIT)
dotnet  13476 root 4046u     IPv4            1409905      0t0      TCP localhost:43147->intgcd01ag01l-ny.something.com:28589 (CLOSE_WAIT)
dotnet  13476 root 4047u     IPv4            1409954      0t0      TCP localhost:45109->intgcd01ag01l-ny.something.com:28589 (CLOSE_WAIT)
dotnet  13476 root 4048u     IPv4            1410008      0t0      TCP localhost:34770->intgcd01ag01l-ny.something.com:28589 (CLOSE_WAIT)
dotnet  13476 root 4049u     sock                0,7      0t0  1411773 protocol: TCP
dotnet  13476 root 4050u     IPv4            1410498      0t0      TCP localhost:56294->intgcd01ag01l-ny.something.com:28589 (CLOSE_WAIT)
dotnet  13476 root 4051u     sock                0,7      0t0  1411832 protocol: TCP
dotnet  13476 root 4052u     IPv4            1410557      0t0      TCP localhost:54762->intgcd01ag01l-ny.something.com:28589 (CLOSE_WAIT)
dotnet  13476 root 4053u     IPv4            1411075      0t0      TCP localhost:47907->intgcd01ag01l-ny.something.com:28589 (CLOSE_WAIT)
dotnet  13476 root 4054u     sock                0,7      0t0  1412376 protocol: TCP
dotnet  13476 root 4055u     sock                0,7      0t0  1411130 protocol: TCP
dotnet  13476 root 4056u     sock                0,7      0t0  1412388 protocol: TCP
dotnet  13476 root 4057u     IPv4            1411148      0t0      TCP localhost:53305->intgcd01ag01l-ny.something.com:28589 (CLOSE_WAIT)
dotnet  13476 root 4058u     sock                0,7      0t0  1413033 protocol: TCP
dotnet  13476 root 4059u     IPv4            1411760      0t0      TCP localhost:47970->intgcd01ag01l-ny.something.com:28589 (CLOSE_WAIT)
dotnet  13476 root 4060u     IPv4            1411813      0t0      TCP localhost:57060->intgcd01ag01l-ny.something.com:28589 (CLOSE_WAIT)
dotnet  13476 root 4061u     sock                0,7      0t0  1419769 protocol: TCP
dotnet  13476 root 4062u     IPv4            1412416      0t0      TCP localhost:35940->intgcd01ag01l-ny.something.com:28589 (CLOSE_WAIT)
dotnet  13476 root 4063u     IPv4            1412463      0t0      TCP localhost:56316->intgcd01ag01l-ny.something.com:28589 (CLOSE_WAIT)
dotnet  13476 root 4064u     sock                0,7      0t0  1413797 protocol: TCP
dotnet  13476 root 4065u     IPv4            1412479      0t0      TCP localhost:49081->intgcd01ag01l-ny.something.com:28589 (CLOSE_WAIT)
dotnet  13476 root 4066u     IPv4            1412532      0t0      TCP localhost:35325->intgcd01ag01l-ny.something.com:28589 (CLOSE_WAIT)
dotnet  13476 root 4067u     sock                0,7      0t0  1414286 protocol: TCP
dotnet  13476 root 4068u     IPv4            1412574      0t0      TCP localhost:43959->intgcd01ag01l-ny.something.com:28589 (CLOSE_WAIT)
dotnet  13476 root 4069u     IPv4            1412927      0t0      TCP localhost:47553->intgcd01ag01l-ny.something.com:28589 (CLOSE_WAIT)
dotnet  13476 root 4070u     sock                0,7      0t0  1414348 protocol: TCP
dotnet  13476 root 4071u     IPv4            1412943      0t0      TCP localhost:53950->intgcd01ag01l-ny.something.com:28589 (CLOSE_WAIT)
dotnet  13476 root 4072u     IPv4            1412999      0t0      TCP localhost:39304->intgcd01ag01l-ny.something.com:28589 (CLOSE_WAIT)
dotnet  13476 root 4073u     sock                0,7      0t0  1414475 protocol: TCP
dotnet  13476 root 4074u     IPv4            1413038      0t0      TCP localhost:34611->intgcd01ag01l-ny.something.com:28589 (CLOSE_WAIT)
dotnet  13476 root 4075u     sock                0,7      0t0  1414542 protocol: TCP
dotnet  13476 root 4076u     IPv4            1413098      0t0      TCP localhost:35949->intgcd01ag01l-ny.something.com:28589 (CLOSE_WAIT)
dotnet  13476 root 4077u     sock                0,7      0t0  1414543 protocol: TCP
dotnet  13476 root 4078u     IPv4            1413116      0t0      TCP localhost:48478->intgcd01ag01l-ny.something.com:28589 (CLOSE_WAIT)
dotnet  13476 root 4079u     IPv4            1413198      0t0      TCP localhost:54521->intgcd01ag01l-ny.something.com:28589 (CLOSE_WAIT)
dotnet  13476 root 4080u     IPv4            1413556      0t0      TCP localhost:59221->intgcd01ag01l-ny.something.com:28589 (CLOSE_WAIT)
dotnet  13476 root 4081u     sock                0,7      0t0  1415012 protocol: TCP
dotnet  13476 root 4082u     IPv4            1413570      0t0      TCP localhost:60623->intgcd01ag01l-ny.something.com:28589 (CLOSE_WAIT)
dotnet  13476 root 4083u     sock                0,7      0t0  1413594 protocol: TCP
dotnet  13476 root 4084u     sock                0,7      0t0  1415095 protocol: TCP
dotnet  13476 root 4085u     IPv4            1413631      0t0      TCP localhost:51840->intgcd01ag01l-ny.something.com:28589 (CLOSE_WAIT)
dotnet  13476 root 4086u     sock                0,7      0t0  1415125 protocol: TCP
dotnet  13476 root 4087u     IPv4            1413664      0t0      TCP localhost:32005->localhost:54862 (ESTABLISHED)
dotnet  13476 root 4088u     IPv4            1413675      0t0      TCP localhost:49913->intgcd01ag01l-ny.something.com:28589 (CLOSE_WAIT)
dotnet  13476 root 4089u     IPv4            1413726      0t0      TCP localhost:40103->intgcd01ag01l-ny.something.com:28589 (CLOSE_WAIT)
dotnet  13476 root 4090u     sock                0,7      0t0  1415227 protocol: TCP
dotnet  13476 root 4091u     IPv4            1413788      0t0      TCP localhost:55769->intgcd01ag01l-ny.something.com:28589 (CLOSE_WAIT)
dotnet  13476 root 4092u     IPv4            1413839      0t0      TCP localhost:36368->intgcd01ag01l-ny.something.com:28589 (CLOSE_WAIT)
dotnet  13476 root 4093u     sock                0,7      0t0  1414318 protocol: TCP
dotnet  13476 root 4094u     sock                0,7      0t0  1415703 protocol: TCP
dotnet  13476 root 4095u     IPv4            1414356      0t0      TCP localhost:42438->intgcd01ag01l-ny.something.com:28589 (CLOSE_WAIT)
```

.NET Core 2.1
```bash
[agupta5@public-100-70-25-153 ~]$ sudo lsof -p 15467 | grep TCP
dotnet  15467 root  176u     IPv4              55785      0t0      TCP *:32005 (LISTEN)
dotnet  15467 root  183u     IPv4            3022464      0t0      TCP localhost:32005->localhost:60452 (ESTABLISHED)
dotnet  15467 root  187u     IPv4            2870819      0t0      TCP localhost:42659->intgcd01ag01l-ny.something.com:28589 (ESTABLISHED)
dotnet  15467 root  188u     sock                0,7      0t0  1149485 protocol: TCP
dotnet  15467 root  195u     IPv4            2978322      0t0      TCP localhost:35198->intgcd01ag01l-ny.something.com:28589 (ESTABLISHED)
dotnet  15467 root  210u     sock                0,7      0t0   391815 protocol: TCP
dotnet  15467 root  211u     sock                0,7      0t0  1692628 protocol: TCP
dotnet  15467 root  212u     IPv4            2870808      0t0      TCP localhost:41519->intgcd01ag01l-ny.something.com:28589 (ESTABLISHED)
dotnet  15467 root  213u     IPv4            3021178      0t0      TCP localhost:44060->intgcd01ag01l-ny.something.com:28589 (ESTABLISHED)
dotnet  15467 root  214u     IPv4            3029521      0t0      TCP localhost:40403->intgcd01ag01l-ny.something.com:28589 (ESTABLISHED)
dotnet  15467 root  215u     sock                0,7      0t0  1149495 protocol: TCP
dotnet  15467 root  216u     sock                0,7      0t0   391840 protocol: TCP
dotnet  15467 root  217u     sock                0,7      0t0  1149514 protocol: TCP
dotnet  15467 root  218u     sock                0,7      0t0  1692636 protocol: TCP
dotnet  15467 root  219u     sock                0,7      0t0  1692655 protocol: TCP
dotnet  15467 root  220u     sock                0,7      0t0  1149520 protocol: TCP
dotnet  15467 root  221u     IPv4            3002860      0t0      TCP localhost:42079->intgcd01ag01l-ny.something.com:28589 (ESTABLISHED)
dotnet  15467 root  222u     IPv4            2955019      0t0      TCP localhost:45330->intgcd01ag01l-ny.something.com:28589 (ESTABLISHED)
dotnet  15467 root  223u     sock                0,7      0t0  1692661 protocol: TCP
dotnet  15467 root  224u     IPv4            3031391      0t0      TCP localhost:37838->intgcd01ag01l-ny.something.com:28589 (ESTABLISHED)
```

**Comment by karelz** [comment]
If it does not reproduce on 2.1, then I recommend to close it.
Or is there anything else left to track?

**Comment by n00j** [comment]
So no potential fix for .net core 1.1? Recommendation is to upgrade?

**Comment by karelz** [comment]
@n00j unless it is critical/blocking and unless it impacts multiple customers, we won't fix it in 1.x. Migrating to 2.1 is the best, easiest and fastest option.
BTW: 1.x has lat year of support: https://github.com/dotnet/core/blob/master/microsoft-support.md

**Comment by n00j** [comment]
ok makes sense, just wanted confirmation before we put in the work.
