### ISSUE TITLE
Cannot create X509Certificate2 from .pem file

### ISSUE THREAD

**Issue by SoptikHa2** [dotnet/corefx#32185]
Hi, I have problem with certificates. I have pem file, which consists of private and public key. I'm able to use the certificate with PHP SoapClient.

```
                string certPath = "koop.pem";
                var client = new MyWsdlSoapClient();
                var cert = new X509Certificate2(certPath);
                client.ClientCredentials.ClientCertificate.Certificate = cert;
                return client.someAction();
```

This code throws bunch of nested exception, the most interesting one is `System.Net.Http.CurlException` : `Failure when receiving data from the peer`.  However, there is no info about *why* it failed.

[Error JSON](https://p.teknik.io/bP2s6)

When I followed #14284 and used `openssl pkcs12 -in publicCert.pem -inkey privateKey.pem -export -out merged.pfx` to create pfx file, and used this code:

```
                string certPath = "koop.pfx";
                var client = new MyWsdlSoapClient();
                var cert = new X509Certificate2(certPath, "certPassword");
                client.ClientCredentials.ClientCertificate.Certificate = cert;
                return client.someAction();
```

I cannot verify mac?

[Error JSON](https://p.teknik.io/Uqcam)

The first code should work, the second one - well, maybe there is something I'm missing. But in the first example, dotnet should tell me what happened, not just that it failed. Is usage of pem certificates even supported? I have `key.pem` and `cert.pem`, which are combined in the `koop.pem` certificate. Do I have to somehow use these two files instead of `koop.pem`?

**Comment by bartonjs** [comment]
> Is usage of pem certificates even supported?

Yes, but just as the certificate, not the private key.  Presumably the Curl error is coming from you not having a private key (including that the cert got disregarded and the remote denied your connection for not using a cert)

> I have key.pem and cert.pem, which are combined in the koop.pem certificate. Do I have to somehow use these two files instead of koop.pem?

Using a PFX is the best way, as it works in all versions on all platforms.  Currently in master there's support for reading private keys from BER files (you have to de-base64 the PEM contents), and you can combine a cert with a key via `cert.CopyWithPrivateKey`

> in the first example, dotnet should tell me what happened, not just that it failed

We got an error from curl, and we passed it on.  We don't actually know what went wrong.  In .NET Core 2.1 we use a different HTTP processor, and it might have better detail.

> the second one - well, maybe there is something I'm missing

"mac verify failure" is what PKCS12_parse returns for "the password is incorrect"

**Comment by SoptikHa2** [comment]
Thank you, I misspelled the password. I decided to try the .pfx, but [this error](https://p.teknik.io/TpNgX) occured. There is curl exception `Failure when receiving data from the peer`. Does this mean that the .pfx is invalid? The .pem certificates are valid, I'm able to connect with PHP.

I'm thankful for your time, but I need your advice once more - this is the first time I'm dealing with certificates and I still don't have enough experience to understand what went wrong and how to fix it.

I could probably just use wireshark to capture what is sent by the wsdl client and use curl to send the request with certificate, but it'd be better if I could do it all in c#.

**Comment by bartonjs** [comment]
@SoptikHa2 The best I can understand is that the server terminated the connection.  Using the SocketsHttpHandler from .NET Core 2.1 (the default HTTP handler in 2.1) may give a better reason, or something like WireShark may be able to see what the server said during the termination.

**Comment by SoptikHa2** [comment]
@bartonjs Sorry for late reply, I had trouble changing project to .NET Core 2.1.

The problem is `Operation is not supported on this platform` when accessing the certificate. I added logs to my project, so I know it happened on line `var cert = new X509Certificate2(certPath, "certPassword");`
I cannot test if it works on windows machine, as the web service has IP address whitelist.

The whole method looks like this:

```
        public object Test()
        {
            try
            {
                string certPath = "koop.pfx";
                var client = new Kooperativa.MajetekServiceExtClient();
                //WriteToLog(-1, DateTime.Now, LogSeverity.Info, "DEBUG: KOOP", Newtonsoft.Json.JsonConvert.SerializeObject(client)); Doesn't work, converting object to json throws exception
                var cert = new X509Certificate2(certPath, "adam"); // Here is the problem
                Database.DatabaseWorker.WriteToLog(-1, DateTime.Now, Database.LogSeverity.Info, "DEBUG: KOOP", Newtonsoft.Json.JsonConvert.SerializeObject(cert)); // This code doesn't run
                client.ClientCredentials.ClientCertificate.Certificate = cert;
                var task = client.inicializaceAsync();
                Database.DatabaseWorker.WriteToLog(-1, DateTime.Now, Database.LogSeverity.Info, "DEBUG: KOOP", Newtonsoft.Json.JsonConvert.SerializeObject(task));
                task.Wait();
                return task.Result;
            }
            catch (Exception ex)
            {
                return ex;
            }
        }
```

[Error log in json](https://p.teknik.io/uRphh)

**Comment by bartonjs** [comment]
Please include callstacks in the issue, instead of having external links (it helps in searching).

```json
{
  "ClassName":"System.PlatformNotSupportedException",
  "Message":"Operation is not supported on this platform.",
  "Data":null,
  "InnerException":null,
  "HelpURL":null,
  "StackTraceString":"   at System.Security.Cryptography.X509Certificates.X509Certificate.System.Runtime.Serialization.ISerializable.GetObjectData(SerializationInfo info, StreamingContext context)\n   at Newtonsoft.Json.Serialization.JsonSerializerInternalWriter.SerializeISerializable(JsonWriter writer, ISerializable value, JsonISerializableContract contract, JsonProperty member, JsonContainerContract collectionContract, JsonProperty containerProperty)\n   at Newtonsoft.Json.Serialization.JsonSerializerInternalWriter.Serialize(JsonWriter jsonWriter, Object value, Type objectType)\n   at Newtonsoft.Json.JsonSerializer.SerializeInternal(JsonWriter jsonWriter, Object value, Type objectType)\n   at Newtonsoft.Json.JsonConvert.SerializeObjectInternal(Object value, Type type, JsonSerializer jsonSerializer)\n   at SrovnavacPojistoven.Core.Insurances.House.Kooperativa.KooperativaHouseWrapper.Test() in C:\\users\\petrs\\Disk Google\\Programovani\\CSharp .NET Core\\ASP projekty\\SrovnavacPojistovenOld22\\SrovnavacPojistoven\\Core\\Insurances\\House\\Kooperativa\\KooperativaHouseWrapper.cs:line 34",
  "RemoteStackTraceString":null,
  "RemoteStackIndex":0,
  "ExceptionMethod":null,
  "HResult":-2146233031,
  "Source":"System.Security.Cryptography.X509Certificates",
  "WatsonBuckets":null
}
```

Says that the exception was actually thrown by your log statement.  The X509Certificate2 object was created fine.

**Comment by SoptikHa2** [comment]
Oh. Thank you, I missed it. The first time logging failed with different exception, and I wasn't giving enough attention.

When I run it without logging, it hangs and the request never finishes. No exception, no result. Everything else works fine, just the test method never finishes. I'll install wireshark and post relevant info here later.

**Comment by SoptikHa2** [comment]
@bartonjs What exactly should I focus on with wireshark? I don't know what would help here.

**Comment by bartonjs** [comment]
Just... things that look wrong? :smile:.

* Did either side send a TLS alert as the last thing they did? If so, what was it?
* Otherwise, what was the last thing that happened?
* Did the client send the client certificate at all?

**Comment by SoptikHa2** [comment]
@bartonjs I'm back 😃 

Sorry it took so long, but I finally got to it.

The wireshark log looks... normal.

`myusername@server:~$ tshark -r capture.pcap | grep '/api' --after-context=50
   30 2.443392524 my_home_ip → my_server_ip HTTP 418 GET /api/ HTTP/1.1 ### Here's call from my computer to my server API
   31 2.443489650 my_server_ip → my_home_ip TCP 54 80 → 49942 [ACK] Seq=1 Ack=365 Win=30336 Len=0
   32 2.503749289 2a02:2b88:... → 2a02:2b88:... DNS 99 Standard query 0x0ee8 A target_url
   33 2.503780452 2a02:2b88:... → 2a02:2b88:... DNS 99 Standard query 0x54c2 AAAA target_url
   34 2.504296797 2a02:2b88:... → 2a02:2b88:... DNS 150 Standard query response 0x54c2 AAAA target_url SOA ext-03.domain.abc
   35 2.504864206 2a02:2b88:... → 2a02:2b88:... DNS 362 Standard query response 0x0ee8 A target_url A target_server_ip NS c.ns.nic.cz NS d.ns.nic.cz NS b.ns.nic.cz NS a.ns.nic.cz AAAA 2001:678:f::1 AAAA 2001:678:10::1 AAAA 2001:678:11::1 AAAA 2001:678:1::1 A 194.0.12.1 A 194.0.13.1 A 194.0.14.1 A 193.29.206.1
   36 2.506065222 my_server_ip → target_server_ip TCP 74 44382 → 443 [SYN] Seq=0 Win=29200 Len=0 MSS=1460 SACK_PERM=1 TSval=3831997691 TSecr=0 WS=128
   37 2.511751109 target_server_ip → my_server_ip TCP 74 443 → 44382 [SYN, ACK] Seq=0 Ack=1 Win=14480 Len=0 MSS=1380 SACK_PERM=1 TSval=1496058584 TSecr=3831997691 WS=128
   38 2.511811788 my_server_ip → target_server_ip TCP 66 44382 → 443 [ACK] Seq=1 Ack=1 Win=29312 Len=0 TSval=3831997692 TSecr=1496058584
   39 2.532376794 my_server_ip → target_server_ip SSL 583 Client Hello
   40 2.538002111 target_server_ip → my_server_ip TCP 66 443 → 44382 [ACK] Seq=1 Ack=518 Win=15616 Len=0 TSval=1496058610 TSecr=3831997697
   41 2.540608505 target_server_ip → my_server_ip TLSv1 2802 Server Hello
   42 2.540698498 my_server_ip → target_server_ip TCP 66 44382 → 443 [ACK] Seq=518 Ack=2737 Win=34688 Len=0 TSval=3831997699 TSecr=1496058612
   43 2.540724559 target_server_ip → my_server_ip TLSv1 756 Certificate, Server Key Exchange, Server Hello Done
   44 2.540734280 my_server_ip → target_server_ip TCP 66 44382 → 443 [ACK] Seq=518 Ack=3427 Win=37504 Len=0 TSval=3831997699 TSecr=1496058612
   45 2.543425843 my_server_ip → target_server_ip TLSv1 200 Client Key Exchange, Change Cipher Spec, Encrypted Handshake Message
   46 2.547940878 my_server_ip → my_home_ip SSH 118 Server: Encrypted packet (len=64)
   47 2.549142446 2a02:2b88:... → ff02::1:... ICMPv6 86 Neighbor Solicitation for 2a02:2b88:... from 52:54:00:...
   48 2.549715194 target_server_ip → my_server_ip TLSv1 125 Change Cipher Spec, Encrypted Handshake Message
   49 2.550452125 my_server_ip → target_server_ip TLSv1 444 Application Data, Application Data
   50 2.550848375 my_server_ip → target_server_ip TLSv1 396 Application Data, Application Data
   51 2.556200422 target_server_ip → my_server_ip TCP 66 443 → 44382 [ACK] Seq=3486 Ack=1360 Win=18816 Len=0 TSval=1496058628 TSecr=3831997702
   52 2.556218443 target_server_ip → my_server_ip TLSv1 103 Encrypted Handshake Message
   53 2.556538617 my_server_ip → target_server_ip TLSv1 615 Encrypted Handshake Message
   54 2.564481414 target_server_ip → my_server_ip TLSv1 4166 Encrypted Handshake Message, Encrypted Handshake Message, Encrypted Handshake Message, Encrypted Handshake Message
   55 2.564519890 my_server_ip → target_server_ip TCP 66 44382 → 443 [ACK] Seq=1909 Ack=7623 Win=45696 Len=0 TSval=3831997705 TSecr=1496058636
   56 2.566566848 my_server_ip → target_server_ip TLSv1 294 Encrypted Handshake Message, Encrypted Handshake Message, Change Cipher Spec, Encrypted Handshake Message
   57 2.571921707 target_server_ip → my_server_ip TLSv1 103 Encrypted Alert
   58 2.572732453 target_server_ip → my_server_ip TCP 66 443 → 44382 [FIN, ACK] Seq=7660 Ack=2137 Win=20992 Len=0 TSval=1496058645 TSecr=3831997706
   59 2.573743193 my_server_ip → target_server_ip TCP 66 44382 → 443 [FIN, ACK] Seq=2137 Ack=7661 Win=45696 Len=0 TSval=3831997708 TSecr=1496058644
   60 2.580704711 target_server_ip → my_server_ip TCP 66 443 → 44382 [ACK] Seq=7661 Ack=2138 Win=20992 Len=0 TSval=1496058651 TSecr=3831997708
   61 2.615589847 my_server_ip → my_home_ip TCP 4434 [TCP segment of a reassembled PDU] ### Here's my server API response to my computer
   62 2.615628536 my_server_ip → my_home_ip TCP 1308 [TCP segment of a reassembled PDU]
   63 2.620945291 my_server_ip → my_home_ip HTTP 59 HTTP/1.1 200 OK  (application/json)
`

Still, I get the cUrl exception `Failure when receiving data from the peer`. This ran at Core 2.0, as I had troubles with my views at Core 2.1. I'll be moving to Core 2.1 when the views aren't necessary anymore (they are there for development purposes - it speeds up development and testing) in about a month anyway.

**Comment by bartonjs** [comment]
@SoptikHa2 Sorry, this apparently fell off my radar.  Were you ever able to get past this problem?  (FWIW, the log link appears to no longer be functioning)

**Comment by SoptikHa2** [comment]
Hi,

I've eventually solved it, but I no longer have any way to test it, so I think this issue may be now closed as invalid.

The solution process included certificate regeneration and using PHP script to actually call the server with the certificate. The certificate regeneration step was basically me downloading existing certificates (that were unchanged) and converting them myself (as their were in bad format, there were previously converted by someone else), so while I don't think this step solved it, I cannot prove it didn't (as I no longer have access to it and can't test it).

Then I wrote simple PHP script that called the server with certificate - I can share the code if needed, and then called the PHP script from ASP application, which did work.

Unfortunately as I can no longer test it, I cannot provide additional information. If no one else had this problem, it's probably because of my setup.

It's weird that you can't see the log, I can see all the logs I posted here. Here's the last log I posted on [pastebin](https://pastebin.com/eRxrcAxc).
